{"$schema":"https://json-schema.org/draft/2020-12/schema","title":"PublicationCommand","type":"object","required":["publication_id","brand_id","platform","account_id","content_package_id","copy_version_id","asset_version_id","scheduled_at","idempotency_key"],"properties":{"publication_id":{"type":"string"},"brand_id":{"type":"string"},"platform":{"enum":["facebook","instagram","google_business_profile","website_blog"]},"account_id":{"type":"string"},"content_package_id":{"type":"string"},"copy_version_id":{"type":"string"},"asset_version_id":{"type":"string"},"scheduled_at":{"type":"string"},"idempotency_key":{"type":"string"}},"additionalProperties":true}
